{
  "contract_version": "artifact-kinds/0",
  "core": {
    "pin": "agent-core c814c2b",
    "entity_kinds": [
      "agent",
      "flow",
      "decision_model",
      "policy",
      "template",
      "prompt",
      "tool",
      "language_detection",
      "injection_ruleset",
      "model_profile",
      "knowledge_snapshot"
    ],
    "draft_only_kinds": [
      "eval_suite"
    ],
    "release_settings_kind": "release_settings",
    "sources": [
      "agent_core/domain/refs.py::EntityKind",
      "agent_core/registry/entities.py::SUITE_KIND",
      "agent_core/registry/models.py::RELEASE_SETTINGS"
    ]
  },
  "verbs": [
    "propose",
    "validate",
    "evaluate",
    "publish"
  ],
  "reasons": [
    "kind_not_supported",
    "missing_precondition",
    "outside_bridge",
    "mutable_reference",
    "release_settings_not_allowed",
    "tool_without_executor",
    "unsupported_capability",
    "release_level_change"
  ],
  "kinds": [
    {
      "kind": "prompt",
      "source": "entity_kind",
      "verbs": {
        "propose": {
          "verdict": "supported",
          "evidence_level": "real-core-live",
          "evidence": [
            "e2e-core/tests/live/test_09_thread01_real_steps.py::test_thread01_steps_5_6_8_9_are_real_narrow_against_core",
            "e2e-core/tests/unit/test_cmppy_compile.py::test_two_operation_spec_compiles_and_validates"
          ],
          "note": "Only op replace (replace_prompt); compile is the claude-standin step, the dry-run digest is Core's. add_prompt (and prompt-variant) and disable are denied(kind_not_supported) by the engine."
        },
        "validate": {
          "verdict": "supported",
          "evidence_level": "real-core-live",
          "evidence": [
            "e2e-core/tests/live/test_09_thread01_real_steps.py::test_thread01_steps_5_6_8_9_are_real_narrow_against_core"
          ],
          "note": "Core dry-run via the bridge; candidate_hash equals the dry-run digest."
        },
        "evaluate": {
          "verdict": "supported",
          "evidence_level": "real-core-live",
          "evidence": [
            "e2e-core/tests/live/test_09_thread01_real_steps.py::test_thread01_steps_5_6_8_9_are_real_narrow_against_core"
          ],
          "note": "Core native evaluation passes before approve; Core arm runs are real (6 per window); the structural gate verdict is a GSIpy stand-in and fails (no_structural_improvement), so steps 8-9 run as a labelled human override."
        },
        "publish": {
          "verdict": "supported",
          "evidence_level": "real-core-live",
          "evidence": [
            "e2e-core/tests/live/test_09_thread01_real_steps.py::test_thread01_steps_5_6_8_9_are_real_narrow_against_core"
          ],
          "note": "Staging publish plus alias read-back; approval JWS comes from the local human-issuer double."
        }
      },
      "notes": "Real today for REPLACE only. Immutable: a new version is published (mutable_reference otherwise)."
    },
    {
      "kind": "eval_suite",
      "source": "draft_only_kind",
      "verbs": {
        "propose": {
          "verdict": "supported",
          "evidence_level": "real-core-live",
          "evidence": [
            "e2e-core/tests/live/test_09_thread01_real_steps.py::test_thread01_steps_5_6_8_9_are_real_narrow_against_core",
            "e2e-core/tests/unit/test_cmppy_compile.py::test_two_operation_spec_compiles_and_validates"
          ],
          "note": "Only op add (add_eval_suite); replace/disable of a suite is denied(kind_not_supported) by the engine. Not a Core EntityKind: a registry draft kind (SUITE_KIND)."
        },
        "validate": {
          "verdict": "supported",
          "evidence_level": "real-core-live",
          "evidence": [
            "e2e-core/tests/live/test_09_thread01_real_steps.py::test_thread01_steps_5_6_8_9_are_real_narrow_against_core"
          ],
          "note": "Core dry-run; platform_* thresholds are a REG-PLATFORM-EDIT violation."
        },
        "evaluate": {
          "verdict": "supported",
          "evidence_level": "real-core-live",
          "evidence": [
            "e2e-core/tests/live/test_09_thread01_real_steps.py::test_thread01_steps_5_6_8_9_are_real_narrow_against_core"
          ],
          "note": "The suite is the yardstick of the native evaluation."
        },
        "publish": {
          "verdict": "supported",
          "evidence_level": "real-core-live",
          "evidence": [
            "e2e-core/tests/live/test_09_thread01_real_steps.py::test_thread01_steps_5_6_8_9_are_real_narrow_against_core"
          ],
          "note": "Suite 2.0.0 is published with the prompt (immutable; one window per fresh stack)."
        }
      },
      "notes": "Draft-only kind, listed because Replace Prompt + Add EvalSuite is the live pair."
    },
    {
      "kind": "flow",
      "source": "entity_kind",
      "verbs": {
        "propose": {
          "verdict": "denied",
          "reason": "kind_not_supported",
          "denied_by": "engine",
          "evidence_level": "stand-in",
          "evidence": [
            "e2e-core/tests/unit/test_cmppy_compile.py::test_denied_kind_not_supported",
            "seams/crates/steps/tests/cmp_compile.rs::four_denied_reasons_are_named"
          ],
          "note": "Engine compile step (CMP stand-in and CMPpy) accepts only replace_prompt and add_eval_suite; every other op/kind pair returns kind_not_supported."
        },
        "validate": {
          "verdict": "not_exercised",
          "evidence_level": "real-core-dry-run",
          "evidence": [
            "core-bridge/tests/authoring/test_authoring_routes.py::test_dry_run_node_limit_is_enforced_by_core_validation_with_the_configured_limit"
          ],
          "note": "Downgraded after independent review: the only evidence is a real Core in-process dry-run that asserts a node-limit VIOLATION (rejection path), not a valid pass, and it is not reachable through the engine compile step. Treat validate as not exercised for the engine until a valid-flow dry-run is shown."
        },
        "evaluate": {
          "verdict": "not_exercised",
          "evidence_level": "none",
          "evidence": [],
          "note": "Not exercised: no flow proposal can be frozen by the engine."
        },
        "publish": {
          "verdict": "not_exercised",
          "evidence_level": "none",
          "evidence": [],
          "note": "Not exercised: no flow proposal can be frozen by the engine."
        }
      },
      "notes": "Codex BKF (offline) and Claude BKFL (live) target this kind; compiled trees are flow content."
    },
    {
      "kind": "agent",
      "source": "entity_kind",
      "verbs": {
        "propose": {
          "verdict": "denied",
          "reason": "kind_not_supported",
          "denied_by": "engine",
          "evidence_level": "stand-in",
          "evidence": [
            "e2e-core/tests/unit/test_cmppy_compile.py::test_denied_kind_not_supported",
            "seams/crates/steps/tests/cmp_compile.rs::four_denied_reasons_are_named"
          ],
          "note": "Engine compile step (CMP stand-in and CMPpy) accepts only replace_prompt and add_eval_suite; every other op/kind pair returns kind_not_supported."
        },
        "validate": {
          "verdict": "not_exercised",
          "evidence_level": "real-core-dry-run",
          "evidence": [
            "core-bridge/tests/authoring/test_authoring_routes.py::test_dry_run_new_agent_without_base_is_reported_not_crashing"
          ],
          "note": "Only a negative case exists: a new agent without base is reported, not crashing."
        },
        "evaluate": {
          "verdict": "not_exercised",
          "evidence_level": "none",
          "evidence": [],
          "note": "Not exercised: no agent proposal can be frozen by the engine."
        },
        "publish": {
          "verdict": "not_exercised",
          "evidence_level": "none",
          "evidence": [],
          "note": "Not exercised: no agent proposal can be frozen by the engine."
        }
      },
      "notes": "Codex BKA (authorized fields, cascade prediction). Core rejects platform_* metric ids (REG-PLATFORM-EDIT). Cascade expected_derived vs auto_bumped (CAP-19) is not exercised."
    },
    {
      "kind": "decision_model",
      "source": "entity_kind",
      "verbs": {
        "propose": {
          "verdict": "denied",
          "reason": "kind_not_supported",
          "denied_by": "engine",
          "evidence_level": "stand-in",
          "evidence": [
            "e2e-core/tests/unit/test_cmppy_compile.py::test_denied_kind_not_supported",
            "seams/crates/steps/tests/cmp_compile.rs::four_denied_reasons_are_named"
          ],
          "note": "Engine compile step (CMP stand-in and CMPpy) accepts only replace_prompt and add_eval_suite; every other op/kind pair returns kind_not_supported."
        },
        "validate": {
          "verdict": "not_exercised",
          "evidence_level": "none",
          "evidence": [],
          "note": "No test submits a decision_model draft to the Core dry-run (the route is kind-generic, decode_entity). Unreachable from the engine until a kind module exists."
        },
        "evaluate": {
          "verdict": "not_exercised",
          "evidence_level": "none",
          "evidence": [],
          "note": "Not exercised: no decision_model proposal can be frozen by the engine."
        },
        "publish": {
          "verdict": "not_exercised",
          "evidence_level": "none",
          "evidence": [],
          "note": "Not exercised: no decision_model proposal can be frozen by the engine."
        }
      },
      "provider_notes": {
        "jev": {
          "verdict": "blocked",
          "blocked_on": "jev",
          "note": "agent-core PR 28 not on main; honest ending is blocked(jev)"
        },
        "classifier": {
          "verdict": "not_exercised"
        },